{
  "schema_version": "1.0.0",
  "review_id": "TEMPLATE-evidence",
  "review_type": "evidence",
  "subject": {
    "repository": "https://github.com/AI-Marketing-Hub/claude-ads",
    "commit_sha": null,
    "tree_sha": null
  },
  "reviewer": {
    "id": null,
    "independence_basis": null,
    "conflict_disclosure": null
  },
  "reviewed_at": null,
  "decision": "pending",
  "evidence_refs": [],
  "findings": [],
  "authentication": null
}
